{
  "$schema": "https://json-schema.org/draft/2020-12/schema",
  "$id": "smarthive/contracts/telemetry.schema.json",
  "title": "Telemetry",
  "description": "Batch of sensor readings (node to server)",
  "type": "object",
  "properties": {
    "schema": {
      "type": "string",
      "pattern": "^smarthive\\.telemetry/1\\.[0-9]+$"
    },
    "msg_id": {
      "type": "string",
      "pattern": "^[0-9a-f]{8}-[0-9a-f]{4}-[0-9a-f]{4}-[0-9a-f]{4}-[0-9a-f]{12}$"
    },
    "node_id": {
      "type": "string",
      "minLength": 1
    },
    "boot_id": {
      "type": "string",
      "pattern": "^[0-9a-f]{8}-[0-9a-f]{4}-[0-9a-f]{4}-[0-9a-f]{4}-[0-9a-f]{12}$"
    },
    "sent_at": {
      "type": "string",
      "pattern": "^\\d{4}-\\d{2}-\\d{2}T\\d{2}:\\d{2}:\\d{2}(\\.\\d+)?Z$"
    },
    "readings": {
      "type": "array",
      "minItems": 1,
      "items": {
        "type": "object",
        "required": [
          "ts",
          "mono_ms",
          "clock_synced",
          "sensor",
          "quantity",
          "value",
          "unit",
          "quality"
        ],
        "properties": {
          "ts": {
            "type": "string",
            "pattern": "^\\d{4}-\\d{2}-\\d{2}T\\d{2}:\\d{2}:\\d{2}(\\.\\d+)?Z$"
          },
          "mono_ms": {
            "type": "integer",
            "minimum": 0
          },
          "clock_synced": {
            "type": "boolean"
          },
          "sensor": {
            "type": "string"
          },
          "quantity": {
            "type": "string"
          },
          "value": {
            "type": [
              "number",
              "null"
            ]
          },
          "unit": {
            "type": "string"
          },
          "quality": {
            "enum": [
              "ok",
              "read_error",
              "clipped",
              "stuck",
              "clock_unsynced"
            ]
          }
        },
        "if": {
          "properties": {
            "quality": {
              "const": "ok"
            }
          }
        },
        "then": {
          "properties": {
            "value": {
              "type": "number"
            }
          }
        }
      }
    }
  },
  "required": [
    "schema",
    "msg_id",
    "node_id",
    "boot_id",
    "sent_at",
    "readings"
  ]
}
