{
  "schema": "smarthive.telemetry/1.0",
  "msg_id": "0190f5a2-7c1e-7d43-9a1b-2f6c8e0d4b01",
  "node_id": "node-0001",
  "boot_id": "6c1f0b0e-3a52-4d0b-9f4c-1a2b3c4d5e6f",
  "sent_at": "2026-10-06T14:05:00.000Z",
  "readings": [
    {
      "ts": "2026-10-06T14:04:00.120Z",
      "mono_ms": 8712345,
      "clock_synced": true,
      "sensor": "dht11-0",
      "quantity": "temp_in",
      "value": 35,
      "unit": "degC",
      "quality": "ok"
    },
    {
      "ts": "2026-10-06T14:04:00.120Z",
      "mono_ms": 8712345,
      "clock_synced": true,
      "sensor": "dht11-0",
      "quantity": "rh_in",
      "value": 58,
      "unit": "pct_rh",
      "quality": "ok"
    },
    {
      "ts": "2026-10-06T14:05:00.118Z",
      "mono_ms": 8712345,
      "clock_synced": true,
      "sensor": "dht11-0",
      "quantity": "temp_in",
      "value": null,
      "unit": "degC",
      "quality": "read_error"
    }
  ]
}
